{
  "id": "enso-complexity",
  "title": "El Niño–Southern Oscillation complexity",
  "short": "ENSO complexity",
  "authors": "Axel Timmermann et al.（约 40 位作者）",
  "venue": "Nature 559, 535–545",
  "year": 2018,
  "doi": "10.1038/s41586-018-0252-6",
  "type": "Review",
  "role": "理论地基",
  "accent": "#7c3aed",
  "pos": { "col": 0, "row": 0 },
  "oneline": "给「ENSO 事件为什么每次都不一样」一个统一的动力学解释框架。",

  "problem": {
    "statement": "经典理论把 ENSO 当单一模态的规则循环，但观测显示事件在强度、空间型、时间演化、可预报性、全球影响上差异极大。作者要给这种「复杂性」一个正式定义与统一的动力学解释。",
    "difficulty": "1958–2015 仅 17 次 El Niño；高质量观测约 40 年而现象跨年代际；地球系统只有一个实现，无对照实验，噪声与低频确定性动力学难以分离；CGCM 有系统性偏差不能替代观测。",
    "domain": ["enso-dynamics", "climate-mode-forecasting"],
    "task": "synthesis-review",
    "object": "ENSO 及全球气候模态系统"
  },

  "methods": ["recharge-oscillator", "coupled-eigenmode-analysis", "eof-analysis", "kernel-density-probability", "observational-diagnosis"],

  "data": {
    "pretrain": [],
    "eval": ["ERSST.v5", "TAO/TRITON Z20", "merged Z20/T300 product", "NMME (9 coupled models)", "CGCM experiments", "paleoclimate reconstructions"]
  },

  "cites": [],

  "baselines": ["composite analysis", "linear recharge oscillator", "single-mode linear theory", "CGCMs"],

  "contributions": [
    "给出 ENSO complexity 的正式定义：在空间型多样性之外，纳入时间尺度、动力学、可预报性与全球影响",
    "统一框架（Fig. 5）：复杂性 = 一对耦合本征模态（QQ≈4yr 温跃层反馈→EP；QB≈2yr 纬向平流反馈→CP）× 激发过程 × 非线性 × 跨时间尺度相互作用",
    "关键洞见：两个本征模态都处在临界（增长率≈0），极易被外部过程激发；EP/CP 是连续谱不是两类",
    "可预报性分层：9–15 月先兆 / 6–9 月触发；热含量是必要非充分条件；拉尼娜可预报性系统性低于厄尔尼诺",
    "方法升级：用核密度概率密度随滞后时间的演化替代事件合成，把先兆从个例叙事变成概率陈述",
    "逆耳结论：几十年预报技巧并未稳定提升；现有气候模式低估 ENSO 多样性"
  ],

  "numbers": [
    ["事件样本", "1958–2015 共 17 次 El Niño"],
    ["组合音 C-mode 谱峰", "9 个月、15–18 个月"],
    ["夏末起报的冬季技巧", "ACC > 0.6"],
    ["两个本征模态周期", "准四年（3–7 年）/ 准两年"],
    ["EOF2 相对 EOF1", "仅解释其方差的 25%（原文表述含糊，慎引）"]
  ],

  "limitations": [
    "双本征模态只在单一中等复杂度模式（Zebiak–Cane）里得到，真实海洋中能否分离未验证",
    "框架四支柱是定性罗列：无权重、无判据",
    "Fig. 4 的 ACC 只对「事后判定为 ENSO 事件」的初值条件计算 → 选择性偏差、技巧被高估",
    "观测记录太短，年代际多样性的来源无法定量归因"
  ],

  "reusable": [
    "XRO 的理论祖先：充放电振子 + 双本征模态，正是 UniCM 最强基线的来源",
    "「热含量必要非充分」直接解释了为什么纯统计模型会有可预报性上限",
    "概率化先兆分析（kernel density vs lead time）是一套可迁移的诊断方法"
  ],

  "notes": [
    ["全文纯文本（可检索）", "ENSO-complexity.txt"],
    ["振子/偏态逻辑链（Mermaid + PNG）", "enso_oscillator_logic_chain.md"]
  ],
  "pdf": "ENSO-complexity.pdf",
  "feishu": {}
}
