{
  "id": "finder",
  "title": "Finding key players in complex networks through deep reinforcement learning",
  "short": "FINDER",
  "authors": "Changjun Fan, Li Zeng, Yizhou Sun, Yang-Yu Liu",
  "venue": "Nature Machine Intelligence 2, 317–326",
  "year": 2020,
  "doi": "10.1038/s42256-020-0177-2",
  "type": "Research Article",
  "role": "方法来源",
  "accent": "#0891b2",
  "pos": { "col": 0, "row": 1 },
  "oneline": "用深度强化学习在小合成网络上训练，直接迁移到真实网络，找出「关键节点」。",

  "problem": {
    "statement": "寻找一组「关键节点」（激活或移除能最大增强/削弱某种网络功能）是网络科学的基础问题，但其一般形式是 NP-hard，此前只有针对特定场景的近似/启发式方法，缺统一框架。",
    "difficulty": "问题是 NP-hard，无法用多项式时间的精确算法；不同应用场景的最优策略差异大，难以用单一启发式覆盖。",
    "domain": ["network-science", "combinatorial-optimization"],
    "task": "combinatorial-optimization",
    "object": "复杂网络（Internet、社交网、电网、食物网、生物分子网络等）"
  },

  "methods": ["deep-reinforcement-learning", "graph-neural-network", "graphsage-encoder", "n-step-q-learning", "synthetic-to-real-transfer"],

  "data": {
    "pretrain": ["小型合成网络（BA 模型等 toy model）"],
    "eval": ["真实网络：Internet / 社交 / 基础设施 / 生物网络等多场景"]
  },

  "cites": [],

  "baselines": ["启发式中心性方法（degree / betweenness / k-shell 等）", "近似算法"],

  "contributions": [
    "提出深度强化学习框架 FINDER：纯在 toy model 生成的小合成网络上训练，再迁移到广泛真实场景",
    "目标函数常用最小化 GCC（最大连通分量），与线性阈值传播下的最优扩散问题互为对偶",
    "解质量显著优于既有方法；在大网络上快几个数量级",
    "开启用深度学习理解复杂网络组织原理的方向，可用于设计更鲁棒的网络"
  ],

  "numbers": [
    ["训练数据", "仅小型合成网络"],
    ["解质量", "显著优于既有方法"],
    ["速度", "大网络上快几个数量级"]
  ],

  "limitations": [
    "核心是「图上的序贯决策」，与物理建模无关",
    "小合成网络 → 真实网络的迁移依赖分布假设，边界需留意"
  ],

  "reusable": [
    "GraphSAGE 编码器 + 外积解码器 + 虚拟节点维护全局状态的架构，可迁移到任何「图上的序贯决策」任务",
    "「小合成数据训练 → 真实场景零样本迁移」这一范式，与 CMIP6 预训练 → 再分析迁移同构",
    "GCC 作为可微/可评估的目标函数设计"
  ],

  "notes": [
    ["组会笔记（三要素 / 架构 / 疑问）", "feishu_week2_summary.md"],
    ["FINDER 代码架构图解", "FINDER-代码架构图解.md"],
    ["强化学习清单与学习路径", "FINDER-强化学习清单与学习路径.md"],
    ["GRACO 代码框架（重新实现 FINDER 思想）", "GRACO/README.md"],
    ["全文纯文本（可检索）", "FINDER.txt"]
  ],
  "pdf": "FINDER.pdf",
  "feishu": { "wiki": "WdbpwCG8giJsxYkjckVce9Y0nce", "docx": "W9xNduWQQovJtyxZ10Zcqk8cnbV", "label": "Week2 Finder" }
}
